{
  "kind": "finding",
  "schema_version": "1.0.0",
  "id": "F-I-26",
  "record_status": "EXAMPLE",
  "created_at": "2026-09-11T23:19:57.136661+00:00",
  "subject_ref": "DRAFTBOARD",
  "instance_refs": [
    "I-26"
  ],
  "class": "VERIFICATION_GAP",
  "severity": "MEDIUM",
  "claim": "In the fictional scenario: Logs are not tied to a deployed artifact and environment.",
  "evidence_refs": [
    "EV-SCENARIO"
  ],
  "counterevidence_refs": [],
  "owner_ref": "ROLE:subject-owner",
  "next_action_kind": "TEST",
  "status": "PROPOSED",
  "wakeup_condition": "Capture and independently verify the real scoped behavior before accepting this row."
}
