{
  "kind": "finding",
  "schema_version": "1.0.0",
  "id": "F-I-06",
  "record_status": "EXAMPLE",
  "created_at": "2026-09-11T23:19:57.136661+00:00",
  "subject_ref": "RELAYSUITE",
  "instance_refs": [
    "I-06"
  ],
  "class": "IMPLEMENTATION_GAP",
  "severity": "MEDIUM",
  "claim": "In the fictional scenario: Independent suites miss the incompatible shared contract.",
  "evidence_refs": [
    "EV-SCENARIO"
  ],
  "counterevidence_refs": [],
  "owner_ref": "ROLE:subject-owner",
  "next_action_kind": "IMPLEMENT",
  "status": "PROPOSED",
  "wakeup_condition": "Add a mismatched-version negative control."
}
