{
  "kind": "finding",
  "schema_version": "1.0.0",
  "id": "F-I-14",
  "record_status": "EXAMPLE",
  "created_at": "2026-09-11T23:19:57.136661+00:00",
  "subject_ref": "PARCELKIT",
  "instance_refs": [
    "I-14"
  ],
  "class": "RESEARCH_GAP",
  "severity": "MEDIUM",
  "claim": "In the fictional scenario: External value is unmeasured even though the local technical slice is assumed to work.",
  "evidence_refs": [
    "EV-SCENARIO"
  ],
  "counterevidence_refs": [],
  "owner_ref": "ROLE:subject-owner",
  "next_action_kind": "RESEARCH",
  "status": "PROPOSED",
  "wakeup_condition": "Measure a real consumer outcome before expanding scope."
}
