{
  "kind": "finding",
  "schema_version": "1.0.0",
  "id": "F-I-11",
  "record_status": "EXAMPLE",
  "created_at": "2026-09-11T23:19:57.136661+00:00",
  "subject_ref": "DRAFTBOARD",
  "instance_refs": [
    "I-11"
  ],
  "class": "IMPLEMENTATION_GAP",
  "severity": "HIGH",
  "claim": "In the fictional scenario: The stated test inventory covers mock handlers, not the accepted persistence obligation.",
  "evidence_refs": [
    "EV-SCENARIO"
  ],
  "counterevidence_refs": [],
  "owner_ref": "ROLE:subject-owner",
  "next_action_kind": "IMPLEMENT",
  "status": "PROPOSED",
  "wakeup_condition": "Capture and independently verify the real scoped behavior before accepting this row."
}
