{
  "kind": "finding",
  "schema_version": "1.0.0",
  "id": "F-I-08",
  "record_status": "EXAMPLE",
  "created_at": "2026-09-11T23:19:57.136661+00:00",
  "subject_ref": "RELAYSUITE",
  "instance_refs": [
    "I-08"
  ],
  "class": "VERIFICATION_GAP",
  "severity": "MEDIUM",
  "claim": "In the fictional scenario: An undocumented second consumer was discovered during review.",
  "evidence_refs": [
    "EV-SCENARIO"
  ],
  "counterevidence_refs": [],
  "owner_ref": "ROLE:subject-owner",
  "next_action_kind": "TEST",
  "status": "PROPOSED",
  "wakeup_condition": "Find its contract version and owner before changing the schema."
}
