{
  "kind": "finding",
  "schema_version": "1.0.0",
  "id": "F-I-11",
  "record_status": "EXAMPLE",
  "created_at": "2026-09-11T23:19:57.136661+00:00",
  "subject_ref": "PARCELKIT",
  "instance_refs": [
    "I-11"
  ],
  "class": "VERIFICATION_GAP",
  "severity": "MEDIUM",
  "claim": "In the fictional scenario: The second consumer still uses the preceding package version.",
  "evidence_refs": [
    "EV-SCENARIO"
  ],
  "counterevidence_refs": [],
  "owner_ref": "ROLE:subject-owner",
  "next_action_kind": "TEST",
  "status": "PROPOSED",
  "wakeup_condition": "Run the actual older consumer against the proposed package."
}
